{
  "$schema": "./registry.schema.json",
  "schemaVersion": "2.0.0",
  "suiteVersion": "2.1.0",
  "updatedAt": "2026-08-05",
  "stack": {
    "frontend":      "Next.js 15, React 19 + RSC, Tailwind CSS v4",
    "mobile":        "React Native, Expo SDK 54, Reanimated v4, EAS",
    "backend":       "Fastify 5, Effect-TS, BullMQ, Redis",
    "database":      "PostgreSQL, Prisma 5, pgvector",
    "monorepo":      "Turborepo, pnpm workspaces",
    "observability": "OpenTelemetry (OTel), structured logging, OTLP",
    "auth":          "Auth.js v5",
    "ai":            "Vercel AI SDK v6, Ollama (local), SwarmX (multi-agent)",
    "runtimes":      "Node.js (API), Edge Runtime (Next.js routes)"
  },
  "verticals": ["TaxBridge", "SabiScore", "Hashablanca", "SwarmX"],
  "skills": [
    {
      "name": "vscode-cognitive-os",
      "version": "1.2.0",
      "description": "Transforms VS Code into a high-performance cognitive workspace via settings.json, keybindings, and extension configs.",
      "cluster": 1,
      "clusterName": "Editor & Environment",
      "installOrder": 1,
      "filePath": ".ai/skills/vscode-cognitive-os/SKILL.md",
      "triggers": [
        "optimize my VS Code",
        "settings.json configuration",
        "make my editor faster",
        "VS Code setup for Next.js",
        "configure VS Code for TypeScript",
        "what extensions should I install",
        "cognitive workspace setup"
      ],
      "dependencies": [],
      "pairedWith": ["typescript-config-surgeon", "vscode-ai-agent-stack", "vscode-monorepo-forge"],
      "verticals": ["all"],
      "tags": ["editor", "productivity", "configuration"]
    },
    {
      "name": "vscode-ai-agent-stack",
      "version": "1.1.0",
      "description": "Configures a production AI coding agent stack in VS Code: Claude Code, GitHub Copilot, and Cline/Continue.dev.",
      "cluster": 1,
      "clusterName": "Editor & Environment",
      "installOrder": 2,
      "filePath": ".ai/skills/vscode-ai-agent-stack/SKILL.md",
      "triggers": [
        "set up Claude Code with VS Code",
        "AI coding tools VS Code",
        "configure Copilot agent mode",
        "Claude Code + Copilot hybrid",
        "best AI coding setup 2026",
        "how do I use multiple AI tools together",
        "Cline or Continue.dev setup"
      ],
      "dependencies": ["vscode-cognitive-os"],
      "pairedWith": ["vscode-debug-profiler", "vscode-monorepo-forge"],
      "verticals": ["all"],
      "tags": ["editor", "ai", "productivity"]
    },
    {
      "name": "vscode-monorepo-forge",
      "version": "1.1.0",
      "description": "Generates complete VS Code multi-root workspace configs: .code-workspace, launch.json, tasks.json, turbo.json pipelines.",
      "cluster": 1,
      "clusterName": "Editor & Environment",
      "installOrder": 3,
      "filePath": ".ai/skills/vscode-monorepo-forge/SKILL.md",
      "triggers": [
        "configure VS Code for my monorepo",
        "generate .code-workspace file",
        "Turborepo VS Code setup",
        "multi-root workspace configuration",
        "pnpm workspace VS Code",
        "my monorepo VS Code setup is a mess",
        "debug multiple packages at once"
      ],
      "dependencies": ["vscode-cognitive-os"],
      "pairedWith": ["typescript-config-surgeon", "vscode-debug-profiler"],
      "verticals": ["all"],
      "tags": ["editor", "monorepo", "turborepo"]
    },
    {
      "name": "vscode-debug-profiler",
      "version": "1.1.0",
      "description": "Configures VS Code debugging and performance profiling for Node.js, Fastify, Next.js, and frontend apps.",
      "cluster": 1,
      "clusterName": "Editor & Environment",
      "installOrder": 4,
      "filePath": ".ai/skills/vscode-debug-profiler/SKILL.md",
      "triggers": [
        "debug my Node.js app in VS Code",
        "set up launch.json for Fastify",
        "CPU profiling VS Code",
        "memory leak in production",
        "how do I find a memory leak",
        "attach debugger to running process",
        "profile my Next.js app"
      ],
      "dependencies": ["vscode-cognitive-os"],
      "pairedWith": ["opentelemetry-observability-architect", "backend-systems-auditor"],
      "verticals": ["all"],
      "tags": ["debugging", "profiling", "performance"]
    },
    {
      "name": "typescript-config-surgeon",
      "version": "1.2.0",
      "description": "Surgically audits and generates tsconfig.json, ESLint flat config, Prettier, and their integration for TypeScript strict mode projects.",
      "cluster": 1,
      "clusterName": "Editor & Environment",
      "installOrder": 5,
      "filePath": ".ai/skills/typescript-config-surgeon/SKILL.md",
      "triggers": [
        "configure TypeScript strict mode",
        "fix my tsconfig.json",
        "set up ESLint flat config",
        "path aliases not working",
        "TypeScript build is slow",
        "ESLint and Prettier are conflicting",
        "project references monorepo"
      ],
      "dependencies": [],
      "pairedWith": ["vscode-cognitive-os", "testing-strategy-architect"],
      "verticals": ["all"],
      "tags": ["typescript", "eslint", "tooling"]
    },
    {
      "name": "git-workflow-architect",
      "version": "1.1.0",
      "description": "Designs and generates complete Git workflows: conventional commits, commitlint, husky, PR templates, and GitHub Actions CI/CD.",
      "cluster": 1,
      "clusterName": "Editor & Environment",
      "installOrder": 6,
      "filePath": ".ai/skills/git-workflow-architect/SKILL.md",
      "triggers": [
        "set up conventional commits",
        "configure husky and commitlint",
        "create a PR template",
        "set up semantic release",
        "GitHub Actions for Next.js",
        "pre-commit hooks setup",
        "branch strategy for my team"
      ],
      "dependencies": [],
      "pairedWith": ["release-incident-operations-architect", "testing-strategy-architect"],
      "verticals": ["all"],
      "claudeCodeCommand": "audit",
      "tags": ["git", "ci-cd", "workflow"]
    },
    {
      "name": "design-token-system-architect",
      "version": "1.2.0",
      "description": "Designs and generates complete design token systems: CSS custom properties, semantic token layers, Tailwind v4 config, dark mode strategy.",
      "cluster": 2,
      "clusterName": "Frontend Design",
      "installOrder": 7,
      "filePath": ".ai/skills/design-token-system-architect/SKILL.md",
      "triggers": [
        "design a token system for my app",
        "set up Tailwind with custom tokens",
        "implement dark mode properly",
        "create a color palette",
        "design system tokens for fintech",
        "CSS variables with Tailwind",
        "set up shadcn/ui tokens"
      ],
      "dependencies": [],
      "pairedWith": ["frontend-product-design-architect", "accessibility-system-architect", "motion-performance-architect"],
      "verticals": ["all"],
      "tags": ["design-system", "tokens", "tailwind", "dark-mode"]
    },
    {
      "name": "frontend-product-design-architect",
      "version": "2.0.0",
      "description": "Shapes premium frontend experiences through information architecture, content hierarchy, responsive layout, and conversion-aware interaction design.",
      "cluster": 2,
      "clusterName": "Frontend Design",
      "installOrder": 8,
      "filePath": ".ai/skills/frontend-product-design-architect/SKILL.md",
      "triggers": [
        "design this page or screen",
        "shape the information architecture",
        "improve the visual hierarchy",
        "design my dashboard or landing page",
        "make this feel premium",
        "conversion design for my page",
        "design TaxBridge or SabiScore UI"
      ],
      "dependencies": [],
      "pairedWith": ["design-token-system-architect", "accessibility-system-architect", "motion-performance-architect", "data-visualization-architect"],
      "verticals": ["TaxBridge", "SabiScore", "SwarmX"],
      "tags": ["ux", "layout", "hierarchy", "conversion", "responsive"]
    },
    {
      "name": "frontend-design-auditor",
      "version": "1.1.0",
      "description": "Audits and elevates web UI designs and components using Gestalt principles, WCAG AA, and Linear/Stripe/Vercel quality standards.",
      "cluster": 2,
      "clusterName": "Frontend Design",
      "installOrder": 9,
      "filePath": ".ai/skills/frontend-design-auditor/SKILL.md",
      "triggers": [
        "audit my UI design",
        "make this look better",
        "is this accessible",
        "design feedback for my component",
        "how would Linear design this",
        "visual hierarchy review",
        "apply Gestalt principles"
      ],
      "dependencies": [],
      "pairedWith": ["frontend-product-design-architect", "accessibility-system-architect", "component-quality-gate"],
      "verticals": ["all"],
      "tags": ["design-audit", "gestalt", "wcag", "critique"]
    },
    {
      "name": "accessibility-system-architect",
      "version": "2.0.0",
      "description": "Designs accessibility as a system: ARIA patterns, keyboard parity, focus management, reduced motion, and WCAG 2.2 AA by construction.",
      "cluster": 2,
      "clusterName": "Frontend Design",
      "installOrder": 10,
      "filePath": ".ai/skills/accessibility-system-architect/SKILL.md",
      "triggers": [
        "make this accessible or WCAG compliant",
        "add keyboard navigation",
        "screen reader support",
        "focus management for modal",
        "ARIA pattern for custom widget",
        "is this accessible",
        "reduced motion support",
        "color contrast audit"
      ],
      "dependencies": [],
      "pairedWith": ["frontend-product-design-architect", "design-token-system-architect", "component-quality-gate", "motion-interaction-architect"],
      "verticals": ["all"],
      "tags": ["accessibility", "wcag", "aria", "keyboard", "a11y"]
    },
    {